{
  "$schema": "https://json-schema.org/draft/2020-12/schema",
  "$id": "simulation_input.v1.json",
  "title": "simulation_input.v1",
  "type": "object",
  "required": [
    "schema_version",
    "simulation_input_id",
    "process_graph_id",
    "process_graph_version",
    "job_type",
    "component_schema",
    "nodes",
    "edges",
    "parameters",
    "runtime_options"
  ],
  "properties": {
    "schema_version": { "const": "simulation_input.v1" },
    "simulation_input_id": { "type": "string", "minLength": 1 },
    "process_graph_id": { "type": "string", "minLength": 1 },
    "process_graph_version": { "type": "integer", "minimum": 1 },
    "job_type": { "type": "string", "enum": ["simulation.material_balance.v1"] },
    "component_schema": { "type": "object" },
    "nodes": { "type": "array", "minItems": 2, "items": { "type": "object" } },
    "edges": { "type": "array", "minItems": 1, "items": { "type": "object" } },
    "time_segments": { "type": "array", "items": { "type": "object" } },
    "parameters": {
      "type": "object",
      "required": ["hours", "steps_per_hour", "solver_method", "tolerance"],
      "properties": {
        "hours": { "type": "number", "exclusiveMinimum": 0 },
        "steps_per_hour": { "type": "integer", "minimum": 1 },
        "solver_method": { "type": "string", "minLength": 1 },
        "tolerance": { "type": "number", "exclusiveMinimum": 0 }
      },
      "additionalProperties": true
    },
    "runtime_options": { "type": "object" },
    "metadata": { "type": "object" }
  },
  "additionalProperties": false
}
